Richard Darrow lives at 5570 Isabella Ave St. Louis in IL, 58540. (contact: 432311234)
Barack Donnelly lives at 7844 S. Greenwood Ave Houston in CA, 38635. (contact: 132311234)
Ann Benes lives at 2447 S. Greenwood Ave Las Vegas in NY, 55366. (contact: 954311234)
Laura Minella lives at 8177 4th Street Dallas in FL, 04119. (contact: 678311234)
Erica Gates lives at 3141 Farnam Street Omaha in CA, 57640. (contact: 132311234)
Warren Darrow lives at 4686 Mt. Lee Drive St. Louis in NY, 94935. (contact: 430411211)
Warren Darrow lives at 6670 S. Greenwood Ave Hollywood in FL, 37288. (contact: 542311234)
Harry Smith lives at 3273 Isabella Ave Houston in FL, 97261. (contact: 224323112)
Steve James lives at 8407 Infinite Loop Drive Las Vegas in WA, 90520. (contact: 432105234)
Erica Neuberger lives at 513 S. Greenwood Ave Miami in IL, 12778. (contact: 954311234)
Aimee Hoover lives at 7341 Vel Avenue Mobile in AL, 35928. (contact: 432311220)
Jonas Gilbert lives at 8852 In St. Saint Paul in MN, 57321. (contact: 562311234)
Regan Darrow lives at 4851 Nec Av. Gulfport in MS, 33193. (contact: 414323112)
StuartK Mckenzie lives at 5529 Orci Av. Nampa in ID, 18562. (contact: 964311234)
Sydney Robinson lives at 894 Ornare. Ave Olathe in KS, 25606. (contact: 190632311)
